{
  "schemaVersion": 1,
  "updatedAt": "2026-09-28T08:35:45.659Z",
  "pollUrl": "https://raw.githubusercontent.com/aziz-mubasher/EasyCasa/main/docs/azm-deliverables/_bridge/status-ledger.json",
  "tasks": [
    {
      "bridgeTaskId": null,
      "kaizenCode": "EC-APP-1-API-M1",
      "polishId": null,
      "title": "Private seller phone never on a public listing response",
      "venture": "EasyCasa",
      "lifecycle": "pr_open",
      "agentStatus": "RUNNING",
      "agentBcId": "bc-302d9a7f-30d9-4f59-b34e-0fe87f8a68f4",
      "agentUrl": "https://cursor.com/agents/bc-302d9a7f-30d9-4f59-b34e-0fe87f8a68f4",
      "branch": "cursor/ec-app-1-api-m1-68f4",
      "prNumber": 248,
      "prUrl": "https://github.com/aziz-mubasher/EasyCasa/pull/248",
      "prState": "DRAFT",
      "dispatchedAt": "2026-09-28T08:35:45.659Z",
      "updatedAt": "2026-09-28T08:35:45.659Z",
      "summary": "Public listing, share link, and agent card hide a private seller phone unless the user has a verified unexpired REA. Census SQL was not run (no production DB).",
      "nextAction": "Review draft PR 248. Run private-seller-phone-census.sql on production after deploy. AZM creates the Kaizen Operations / Improve card by hand.",
      "errors": []
    },
    {
      "bridgeTaskId": "task_ec_transparency_15sep",
      "kaizenCode": "K EC TRANSPARENCY",
      "polishId": "PP-TRANSPARENCY",
      "title": "transparency 15 Sep honesty pass",
      "venture": "EasyCasa",
      "lifecycle": "merged",
      "agentStatus": "IDLE",
      "agentBcId": "bc-bb45221b-baea-4a36-a15c-841c443a0bb0",
      "agentUrl": "https://cursor.com/agents/bc-bb45221b-baea-4a36-a15c-841c443a0bb0",
      "branch": "cursor/transparency-honesty-0bb0",
      "prNumber": 242,
      "prUrl": "https://github.com/aziz-mubasher/EasyCasa/pull/242",
      "prState": "MERGED",
      "dispatchedAt": "2026-09-15T18:02:21.499Z",
      "updatedAt": "2026-09-15T18:32:47.081Z",
      "summary": "PR #242 merged and web deployed (3b0ea96). Live /en/transparency: T1 names inactive 2.49% SKUs; no ever-in-any-form; Credit Prime; art. 52/59+ODR; source+semester; featured disclosed. API untouched.",
      "nextAction": "AZM: visura / LEGAL_ENTITY. Decide PR A vs leave T1 disclosure. Pilot end date still open. Counsel before dropping OFFER_DRAFTING. Kaizen Operations + Startup Phase 3 need a human board write.",
      "errors": []
    },
    {
      "bridgeTaskId": "task_ec_acquisto_15sep",
      "kaizenCode": "K EC ACQUISTO",
      "polishId": "PP-ACQUISTO",
      "title": "acquisto-assistito 15 Sep honesty + G1 /about correction",
      "venture": "EasyCasa",
      "lifecycle": "merged",
      "agentStatus": "IDLE",
      "agentBcId": "bc-bb45221b-baea-4a36-a15c-841c443a0bb0",
      "agentUrl": "https://cursor.com/agents/bc-bb45221b-baea-4a36-a15c-841c443a0bb0",
      "branch": "cursor/acquisto-about-honesty-0bb0",
      "prNumber": 240,
      "prUrl": "https://github.com/aziz-mubasher/EasyCasa/pull/240",
      "prState": "MERGED",
      "dispatchedAt": "2026-09-15T17:41:37.162Z",
      "updatedAt": "2026-09-15T17:41:37.162Z",
      "summary": "PR #240 merged and web deployed (6139cd7). Live /en /it /es acquisto-assistito: spec table, art. 1655, art. 52/59 + ODR, denominazione hole, no €10,980. Live /en/about G1: no sellers-pay-no-commission / close line. Pricing footer has withdrawal + ODR. API untouched.",
      "nextAction": "AZM: visura / incorporation fields. Counsel before rewriting steps 03/04 or dropping OFFER_DRAFTING. Do not restore G1 percentage denial while FULL_MEDIATION / BUYER_MEDIATION remain in catalog.ts. Kaizen Operations + Startup Phase 3 need a human board write.",
      "errors": []
    },
    {
      "bridgeTaskId": "task_ec_about_15sep",
      "kaizenCode": "K EC ABOUT",
      "polishId": "PP-ABOUT",
      "title": "K EC ABOUT",
      "venture": "EasyCasa",
      "lifecycle": "merged",
      "agentStatus": "IDLE",
      "agentBcId": "bc-b8598c85-da4c-4760-8cbf-46f45386740a",
      "agentUrl": "https://cursor.com/agents/bc-b8598c85-da4c-4760-8cbf-46f45386740a",
      "branch": "cursor/about-honesty-pass-740a",
      "prNumber": 238,
      "prUrl": "https://github.com/aziz-mubasher/EasyCasa/pull/238",
      "prState": "MERGED",
      "dispatchedAt": "2026-09-15T15:06:49.334Z",
      "updatedAt": "2026-09-15T17:41:37.186Z",
      "summary": "PR #238 merged+deployed (31c2717). G1 correction shipped in PR #240 / 6139cd7 (live): /en/about no longer says sellers pay no commission or ‘we do not take a percentage’. Identity hole unchanged.",
      "nextAction": "AZM: visura / incorporation fields. EC-S-36 before any publish-verification card or “directly”. Kaizen Operations + Startup Phase 3 need a human board write.",
      "errors": []
    },
    {
      "bridgeTaskId": "task_ec_for_buyers_15sep",
      "kaizenCode": "K EC FOR-BUYERS",
      "polishId": "EC-B-15SEP",
      "title": "for-buyers 15 Sep: retract badge, factual OMI, pricing link",
      "venture": "EasyCasa",
      "lifecycle": "merged",
      "agentStatus": "IDLE",
      "agentBcId": "bc-9f454520-4fd5-4046-9da5-655c8535ec0c",
      "agentUrl": "https://cursor.com/agents/bc-9f454520-4fd5-4046-9da5-655c8535ec0c",
      "branch": "cursor/for-buyers-badge-retract-ec0c",
      "prNumber": 235,
      "prUrl": "https://github.com/aziz-mubasher/EasyCasa/pull/235",
      "prState": "MERGED",
      "dispatchedAt": "2026-09-15T10:29:18.937Z",
      "updatedAt": "2026-09-15T11:37:15.200Z",
      "summary": "PR #235 merged and web deployed (90dca67). Live /en /it /es for-buyers: badge retracted, factual OMI, no-commission + one-side + /pricing CTA.",
      "nextAction": "AZM: visura for footer P.IVA; Credit Prime must issue the delibera to the buyer before any replacement block. Kaizen Operations + Startup Phase 3 need a human board write.",
      "errors": []
    },
    {
      "bridgeTaskId": "task_ec_pricing_final",
      "kaizenCode": "K EC PRICING",
      "polishId": "EC-PRICING-FINAL",
      "title": "EC-PRICING-FINAL — PONTE price list",
      "venture": "EasyCasa",
      "lifecycle": "merged",
      "agentStatus": "IDLE",
      "agentBcId": "bc-9f454520-4fd5-4046-9da5-655c8535ec0c",
      "agentUrl": "https://cursor.com/agents/bc-9f454520-4fd5-4046-9da5-655c8535ec0c",
      "branch": "cursor/ec-pricing-final-ec0c",
      "prNumber": 231,
      "prUrl": "https://github.com/aziz-mubasher/EasyCasa/pull/231",
      "prState": "MERGED",
      "dispatchedAt": "2026-09-15T07:18:20.393Z",
      "updatedAt": "2026-09-15T08:14:28.615Z",
      "summary": "PR #231 merged and deployed. Live /api/version gitSha 77f9e55. Catalog has 13 fixed items, no provvigione. /en /it /es pricing show PONTE list + enrollment line.",
      "nextAction": "AZM to confirm D10 (free vs paid publication) and commercial prices. Do not build PR E until Credit Prime issues the delibera to the buyer. Kaizen Operations + Startup Phase 3 still need a human board write.",
      "errors": []
    },
    {
      "bridgeTaskId": "task_ecs_36",
      "kaizenCode": "K EC 7.7",
      "polishId": "EC-S-36",
      "title": "EC-S-36 — lead-routing census",
      "venture": "EasyCasa",
      "lifecycle": "pr_open",
      "agentStatus": "RUNNING",
      "agentBcId": "bc-54c2f7a2-0d31-48b6-a15c-1fe2a9536ade",
      "agentUrl": "https://cursor.com/agents/bc-54c2f7a2-0d31-48b6-a15c-1fe2a9536ade",
      "branch": "cursor/ecs-36-lead-routing-census-6ade",
      "prNumber": 222,
      "prUrl": "https://github.com/aziz-mubasher/EasyCasa/pull/222",
      "prState": "OPEN",
      "dispatchedAt": "2026-09-07T20:57:49.522Z",
      "updatedAt": "2026-09-07T20:57:49.522Z",
      "summary": "PR #222 merge after #221 land. Read-only census.",
      "nextAction": "Merge #222.",
      "errors": []
    },
    {
      "bridgeTaskId": "task_ecs_34",
      "kaizenCode": "K EC 1.59",
      "polishId": "EC-S-34",
      "title": "EC-S-34 — /vendi-da-privato honesty pass",
      "venture": "EasyCasa",
      "lifecycle": "merged",
      "agentStatus": "IDLE",
      "agentBcId": "bc-54c2f7a2-0d31-48b6-a15c-1fe2a9536ade",
      "agentUrl": "https://cursor.com/agents/bc-54c2f7a2-0d31-48b6-a15c-1fe2a9536ade",
      "branch": "cursor/ecs-34-honesty-pass-6ade",
      "prNumber": 221,
      "prUrl": "https://github.com/aziz-mubasher/EasyCasa/pull/221",
      "prState": "MERGED",
      "dispatchedAt": "2026-09-07T20:53:09.671Z",
      "updatedAt": "2026-09-07T20:57:49.544Z",
      "summary": "MERGED #221+#223. Deploying apps/web.",
      "nextAction": "Confirm live /vendi-da-privato after web deploy.",
      "errors": []
    },
    {
      "bridgeTaskId": null,
      "kaizenCode": "K EC 1.57",
      "polishId": null,
      "title": "EC-B-08 /for-buyers honesty pass",
      "venture": "EasyCasa",
      "lifecycle": "merged",
      "agentStatus": "IDLE",
      "agentBcId": "bc-8f45d416-f823-462e-afef-522ac15c61f7",
      "agentUrl": "https://cursor.com/agents/bc-8f45d416-f823-462e-afef-522ac15c61f7",
      "branch": "cursor/ec-b-08-honesty-pass-61f7",
      "prNumber": 217,
      "prUrl": "https://github.com/aziz-mubasher/EasyCasa/pull/217",
      "prState": "MERGED",
      "dispatchedAt": "2026-09-07T18:58:29.031Z",
      "updatedAt": "2026-09-07T19:45:33.286Z",
      "summary": "MERGED #217+#218 and DEPLOYED apps/web @ c90e579 (PRs 217+218). Live /for-buyers titles are honesty-pass copy. API untouched @ 3cc5099. P04/G1 not flipped.",
      "nextAction": "Claude can quote merged+deployed. Boards K EC 1.57 / S EC 1.57 at 100%. Do not flip P04 or G1.",
      "errors": []
    },
    {
      "bridgeTaskId": "task_ec_a11y_1",
      "kaizenCode": "K EC A11Y-1",
      "polishId": "EC-A11Y-1",
      "title": "EC-A11Y-1 — site-wide document title (layout generateMetadata)",
      "venture": "EasyCasa",
      "lifecycle": "merged",
      "agentStatus": "IDLE",
      "agentBcId": "bc-f4778576-93df-49c2-8bd6-5b333349c84d",